{
  "certified_stop_version": "certified-stop-record-v0.1",
  "certified_stop_id": "cstop_a37618d3b3ec98132ad4242ba477e9cc699ef061f464c8312a5f240e057bbf39",
  "record_scope": "source_certificate_identity_terminal_declaration_only",
  "surface_id": "project05_depth2_public",
  "package_id": "pkg_73d77b55ef6a517a0dc528f7f3a89bd9",
  "is_certified_stop": true,
  "is_certificate": false,
  "is_e_case": false,
  "is_kernel_store_record": false,
  "is_ordinary_run_mvp_stop": false,
  "source_certificate": {
    "record_path": "docs/llm-editor/fixtures/certificate/project05-depth2-public-v0.1/certificate-record.json",
    "record_sha256": "a7cead6c0315ede6859000db63990f8148c258c2350fba0e99d368ca4a4fa40c",
    "receipt_path": "docs/llm-editor/fixtures/certificate/project05-depth2-public-v0.1/sanitized-receipt.json",
    "receipt_sha256": "b1190082b3879fe070eb816c1684354783fcc4b6a0773176b29659e2822f5f64",
    "certificate_id": "cert_2d016caab300bc0a25cd7d973a2ba3d0116dcb74277bc45f0d5ed6b1ef7efd00",
    "source_is_certificate": true,
    "source_is_e_case": false,
    "source_is_kernel_store_record": false,
    "source_is_certified_stop": false,
    "source_is_ordinary_run_mvp_stop": false
  },
  "source_package_state": {
    "claim_id_state": "minted_opaque",
    "admission_state": "admitted_under_separate_authority",
    "kernel_state": "ingested_under_separate_authority",
    "claim_count": 41,
    "claims_content_hash": "594c0ec4c4533b1fae76ce57579cf52c783e61fc6b191d9807ce9751e5d473f1"
  },
  "claim_identity_summary": {
    "claim_count": 41,
    "claim_id_list_sha256": "11ef0f4672d9f43357639e46c19b27474ddcdf40daffb9acb93af9c810d008a4",
    "claim_values_copied": false
  },
  "certified_stop_subject": {
    "subject_kind": "provenance_certificate",
    "certificate_id": "cert_2d016caab300bc0a25cd7d973a2ba3d0116dcb74277bc45f0d5ed6b1ef7efd00",
    "certified_stop_scope": "terminal_declaration_of_exact_provenance_certificate_identity_only_not_checker_acceptance_not_evidence_sufficiency_not_run_mvp_ordinary_stop"
  },
  "provenance": {
    "effective_certificate_schema": {
      "artifact_id": "certificate-record-effective-v0.1",
      "version": "0.1",
      "path": "schemas/certificate-record-effective-v0.1.schema.json",
      "sha256": "a29f5a13944242076973c1d735f33cf82d7e7665c622b4c3e8ac52434d72677d",
      "status": "effective_certificate_target_schema_semantics_only_issue_not_authorized",
      "owner": "Kernel/Checker"
    },
    "effective_certificate_issue_write_contract": {
      "artifact_id": "kernel-v0.8-certificate-issue-write-contract-effective-v0.1-20260725",
      "version": "0.1",
      "path": "docs/kernel/kernel-v0.8-certificate-issue-write-contract-effective-v0.1-20260725.json",
      "sha256": "fccfbb9066e3cc0ef2abaff775f34b36c512bc1d13ca23dca675d32f622793dc",
      "status": "effective_certificate_issue_write_contract_semantics_only_issue_not_authorized",
      "owner": "Kernel/Checker"
    },
    "effective_certified_stop_schema": {
      "artifact_id": "certified-stop-record-effective-v0.1",
      "version": "0.1",
      "path": "schemas/certified-stop-record-effective-v0.1.schema.json",
      "sha256": "80a63e23b61914a42d9a6e9fc954b210f5321c263a18844a2bcb82c6c1acbd2c",
      "status": "effective_certified_stop_target_schema_semantics_only_execution_not_authorized",
      "owner": "Kernel/Checker"
    },
    "effective_certified_stop_write_contract": {
      "artifact_id": "kernel-v0.8-certified-stop-write-contract-effective-v0.1-20260725",
      "version": "0.1",
      "path": "docs/kernel/kernel-v0.8-certified-stop-write-contract-effective-v0.1-20260725.json",
      "sha256": "75073ab3edbf849cfaf10c799fec53e5ad0084a6b5228283781c4295a67c79cd",
      "status": "effective_certified_stop_write_contract_semantics_only_execution_not_authorized",
      "owner": "Kernel/Checker"
    }
  },
  "checker_decision_ref": null,
  "evidence_sufficiency_ref": null,
  "issue_authority": {
    "activation_artifact_id": "llm_editor_v0_8_l2_production_certified_stop_single_execute_activation_v0_1_20260725",
    "activation_path": "docs/llm-editor/llm-editor-v0.8-l2-production-certified-stop-single-execute-activation-v0.1-20260725.json",
    "activation_sha256_before": "bc68c088f0fdaf20e9847acb52d365b23f016e12e46ee6e67408b2e651ba067a",
    "executor_path": "src/compiler/llm/certified_stop_executor.py",
    "executor_sha256": "c2bf36040cec6ee517d57baf8f3814fbb519be94b8f9c825ac179792a0548971",
    "single_use": true
  },
  "transaction": {
    "certified_stop_target_id": "certified-stop:project05_depth2_public:pkg_73d77b55ef6a517a0dc528f7f3a89bd9:v0.1",
    "transaction_id": "cstop_txn_8179b88703b17bb349257dc3a3c66b71",
    "idempotency_key": "cstop_idem_d865f3173026ce7d0024a952124e2bcfad0317c58e0f0e13bc5bd5ace995022b",
    "atomic_all_or_nothing": true,
    "partial_write": false,
    "retry": false,
    "resume": false,
    "fallback": false
  },
  "separation_assertions": {
    "source_certificate_unchanged": true,
    "source_is_certified_stop": false,
    "certified_stop_is_certificate": false,
    "certified_stop_is_e_case": false,
    "certified_stop_is_kernel_store_record": false,
    "certified_stop_is_ordinary_run_mvp_stop": false,
    "checker_invoked_by_certified_stop_writer": false,
    "checker_acceptance_or_promotion_implied": false,
    "evidence_sufficiency_defaulted": false,
    "si_llm_001_closed": false,
    "l2_or_part_b_gate_passed": false
  }
}
